ID,Excerpt,SY1,SY2,CO1,CO2,LQ Code
795,"Data compliance checks are to be conducted periodically, with 'periodically' undefined.",data compliance,checks,conducted,periodically,MLN
796,A robust reporting feature is included without detailing its robustness.,reporting feature,robust,included,,MLN
797,Automatic error detection is a system feature yet provides no detail on its operation.,error detection,automatic,system feature,,MLN
798,A fast and efficient search functionality is touted with no criteria for 'fast' or 'efficient'.,search functionality,fast and efficient,touted,,MLN
799,The interface will adapt to various screen sizes without citing specific sizes or devices.,interface,adapt,screen sizes,devices,MLN
800,"The protocol needs to ensure secure transfer, though security parameters are undefined.",protocol,,,,MLN
801,Users shall be able to retrieve information rapidly but the term rapidly is not quantified.,rapidly,,information retrieval speed,,MLN
802,The system provides a robust interface with no clear description of robustness.,robust,interface,,,MLN
803,"Application's user experience should be intuitive, which remains subjective without criteria.",intuitive,user experience,,,MLN
804,"The data processing module will handle large datasets, yet 'large' is not specified.",large,datasets,,,MLN
805,Response time should be fast without an actual timeframe being stated.,fast,response time,,,MLN
806,"Ensure compatibility with common platforms, where common is not clarified.",common,compatibility,platforms,,MLN
807,The user interface shall be user-friendly with user-friendly remaining vague.,user-friendly,user interface,,,MLN
808,Execution of tasks needs to be efficient without defining efficient.,efficient,execution,tasks,,MLN
809,"The system shall perform with high reliability, high is subjective without context.",high,reliability,system performance,,MLN
810,"Data should remain consistent across sessions, with no definition for consistent.",consistent,,data,sessions,MLN
811,"The platform will support multiple users, but 'multiple' lacks quantification.",multiple,users,platform support,,MLN
812,Our software guarantees seamless operation with no description of seamless.,seamless,operation,software guarantee,,MLN
813,"Enhance customer satisfaction levels, yet without measurable criteria for satisfaction.",customer satisfaction,levels,enhance,,MLN
814,Traffic handling should be optimal but fails to state what optimal entails.,optimal,traffic handling,,,MLN
815,"The architecture must be scalable, with scalable being an unclear term.",scalable,architecture,,,MLN
816,"Ensure the system is easily maintainable, though easily is subjective.",easily,maintainable,system,,MLN
817,Improve processing speeds to be competitive without specifying competitive speeds.,competitive,processing speeds,improve,,MLN
818,"The product shall be future-proof, an unclear and ambiguous term.",future-proof,product,,,MLN
819,System stability shall not be compromised but does not explain stable conditions.,stable,system stability,,compromised,MLN
820,Offer quick problem resolution without any benchmark for what quick constitutes.,quick,problem resolution,offer,,MLN
821,"Data integrity must be uncompromised, yet integrity is not properly defined.",data integrity,,uncompromised,,MLN
822,The interface should be straightforward to use but straightforward is not explained.,straightforward,interface,,use,MLN
823,Safeguard the system against common threats without defining common threats.,common,threats,safeguard,system,MLN
824,Optimize query response without specifying what optimized performance looks like.,optimized,query response,,,MLN
825,"The application must always remain responsive, 'always' lacking critical definition.",always,responsive,application,,MLN
826,Enhance system robustness without specifying what enhancements are necessary.,enhance,robustness,system,,MLN
827,"Data storage solutions should be cost-effective, with cost-effective not quantified.",cost-effective,data storage solutions,,,MLN
828,Make sure the software is highly available without clarity on 'highly'.,highly,available,software,,MLN
829,"Deliver content in the most efficient way possible, 'most efficient' is subjective.",most efficient,deliver content,,,MLN
830,Increase transaction speeds to industry standards without stating the standards.,industry standards,transaction speeds,increase,,MLN
831,"Our service provides enhanced security measures, 'enhanced' lacks clarity.",enhanced,security measures,service,,MLN
832,"There will be a significant user growth, with no indication of what significant means.",significant,user growth,,,MLN
833,Implement a user-friendly approach which is a vague and undefined phrase.,user-friendly,approach,implement,,MLN
834,"Ensure timely updates, where timely is not numerically specified.",timely,updates,ensure,,MLN
835,Processes should be streamlined without stating how or what that entails.,streamlined,processes,,,MLN
836,"The network must support heavy usage scenarios, 'heavy' is too vague.",heavy,usage scenarios,network support,,MLN
837,Deploy updates in a seamless fashion without defining what seamless update deployment is.,seamless,update deployment,deploy,,MLN
838,Guarantee a smooth user transition with no explanation of smooth.,smooth,user transition,guarantee,,MLN
839,Achieve higher throughput in data processing without specifying what 'higher' refers to.,higher,throughput,data processing,,MLN
840,The system shall enable interface configuration without clear guidelines on the setup process.,interface configuration,,,,MLN
841,User data synchronization must occur across platforms but does not specify the nature of data to synchronize.,data synchronization,platforms,,,MLN
842,"The application should ensure robust operation, yet it omits the definition of robust in context.",robust operation,,,,MLN
843,Fault tolerance must be considered without providing parameters for acceptable fault levels.,fault tolerance,,,,MLN
844,All transactions should be secure though it fails to describe the security measures or standards.,transactions,secure,,,MLN
845,"The system must have a user-friendly interface, but does not define the criteria for 'user-friendly'.",user-friendly interface,,,,MLN
846,Response time should be fast without reference to specific measurable limits.,Response time,fast,,,MLN
847,The software is expected to be fully compatible with all devices but doesn't specify compatibility requirements.,compatible,devices,,,MLN
848,"Users should be able to operate the system with ease, yet 'ease' is not quantified or elaborated on.",operate,ease,,,MLN
849,The platform will support third-party integrations with no mention of specific third party services.,third-party integrations,,,,MLN
850,Performance should be optimal across all usage scenarios without defining the term 'optimal'.,Performance,optimal,,,MLN
851,"The system must be scalable, with no specific thresholds or criteria for scalability provided.",scalable,,,,MLN
852,"Reliability is a required feature, yet no definition of reliability is found within the requirement.",Reliability,,,,MLN
853,"Maintenance procedures should be simple, yet 'simple' is not defined or described.",Maintenance procedures,simple,,,MLN
854,"The system's modularity allows for easy upgrades, but does not identify what constitutes an 'easy' upgrade.",modularity,easy upgrades,,,MLN
855,"Resource usage should be minimized, although the requirement omits any concrete usage metrics.",Resource usage,minimized,,,MLN
856,"Data transfer rates must be high, without providing a benchmark for 'high' rates.",Data transfer rates,high,,,MLN
857,The software should support maximum user loads with no information on actual load numbers.,maximum user loads,,,,MLN
858,"Accessibility for all users must be guaranteed, though it lacks a clear definition of 'accessibility'.",Accessibility,all users,,,MLN
859,Backups should occur regularly without specifying backup frequency or scope.,Backups,regularly,,,MLN
860,"System updates will be seamless, but the term 'seamless' is not explained or quantified.",System updates,seamless,,,MLN
861,"Features shall be intuitive to use, without outlining what makes a feature 'intuitive'.",Features,intuitive,,,MLN
862,"Failover processes must be automatic, yet the requirement does not establish criteria for 'automatic'.",Failover processes,automatic,,,MLN
863,Server response should be instantaneous without presenting what 'instantaneous' really means.,Server response,instantaneous,,,MLN
864,"Data integrity is paramount, but the requirement does not specify the ways to achieve or measure it.",Data integrity,paramount,,,MLN
865,"The user interface must be clean, although 'clean' is subjective and not further described.",user interface,clean,,,MLN
866,Error messages should be informative without clarifying what constitutes informative content.,Error messages,informative,,,MLN
867,Application performance must remain stable under all conditions but neglects to define 'stable'.,Application performance,stable,,,MLN
868,Customization options should be abundant without examples or a range of options provided.,Customization options,abundant,,,MLN
869,"The platform needs to be future-proof, yet it does not specify the expectations for future-proofing.",future-proof,platform,,,MLN
870,Navigation within the system should be straightforward without clarification on navigation standards.,Navigation,straightforward,,,MLN
871,"There must be minimal input lag, although the term 'minimal' is not quantified.",input lag,minimal,,,MLN
872,"The product shall offer flexible solutions, but 'flexible' lacks a clear, objective definition.",flexible solutions,,,,MLN
873,"Updates must not disrupt user activity, yet what constitutes 'disruption' is not explained.",Updates,disrupt,,,MLN
874,User profiles are to be personalized without providing criteria for personalization features.,User profiles,personalized,,,MLN
875,The system will handle large datasets efficiently without detail on what is considered efficient.,large datasets,efficiently,,,MLN
876,The architecture must be robust and extensible without explaining these quality attributes.,architecture,robust and extensible,,,MLN
877,Software documentation should be comprehensive but does not specify the required details or scope.,Software documentation,comprehensive,,,MLN
878,"Interfaces shall be compatible with modern standards, which remain unspecified within the requirement.",Interfaces,modern standards,,,MLN
879,"System outputs must be accurate, yet the definition of accuracy is absent.",System outputs,accurate,,,MLN
880,The application shall provide user flexibility without clarifying adaptive features.,flexibility,,,,MLN
881,A secure login is mandated but no security protocols are enumerated.,secure login,,security protocols,,MLN
882,Data analytics will be robust without specifying the criteria for robustness.,robust,,criteria for robustness,,MLN
883,System uptime shall be maximized with no minimum threshold provided.,maximized,,minimum threshold,,MLN
884,Reports must be generated quickly without defining the expected time frame.,quickly,,time frame,,MLN
885,The system should be user-friendly but lacks context for usability standards.,user-friendly,,usability standards,,MLN
886,Platform compatibility is necessary yet the compatible platforms aren't listed.,compatibility,,compatible platforms,,MLN
887,Real-time updates are important although what constitutes 'real-time' is not described.,real-time,updates,,,MLN
888,The product must be intuitive to use with no further detail on intuitiveness.,intuitive,,detail on intuitiveness,,MLN
889,Integration with existing systems is required but no specifications are provided.,Integration,,existing systems,specifications,MLN
890,"Enhanced performance is a goal, yet 'enhanced' is not quantified.",Enhanced,performance,,,MLN
891,Seamless operation is expected with no description of what seamless entails.,Seamless,operation,description,seamless entails,MLN
892,"The interface must be responsive, but 'responsive' remains undefined.",responsive,interface,undefined,,MLN
893,"Personalization options are essential, however, the extent of customization is unclear.",Personalization,options,customization,extent,MLN
894,Data must be consistent yet provides no metric for consistency.,consistent,Data,metric,consistency,MLN
895,The transaction speed should be fast without stating a baseline speed.,fast,transaction,speed,baseline,MLN
896,An intuitive user interface is required but it's not clear what makes an interface intuitive.,intuitive,user interface,required,clear,MLN
897,Automatic updates must be provided without frequency details.,Automatic,updates,provided,frequency,MLN
898,"The workflow must be natural, though 'natural' is not operationalized.",natural,workflow,operationalized,,MLN
899,Easy navigation is highlighted but lacks a comparison to what is considered difficult.,Easy,navigation,highlighted,comparison,MLN
900,User control should be extensive yet 'extensive' is left to interpretation.,extensive,user control,interpretation,,MLN
901,"The software needs to be state-of-the-art, with no criteria for what constitutes it.",state-of-the-art,software,criteria,constitutes,MLN
902,Cross-platform functionality is necessary without listing supported platforms.,Cross-platform,functionality,necessary,supported platforms,MLN
903,The system requires high availability but does not define 'high'.,high,availability,system,requires,MLN
904,User experience must be engaging without illustrating what 'engaging' entails.,engaging,user experience,illustrating,entails,MLN
905,"Enhancements should be continuous, yet without indicating the frequency of enhancements.",Enhancements,continuous,indicating,frequency,MLN
906,"The system must support dynamic content, yet 'dynamic' isn't specified.",dynamic,content,system,specified,MLN
907,Resource utilization should be optimal without defining optimality.,optimal,Resource utilization,defining,optimality,MLN
908,The information architecture must be scalable without qualification of scale.,scalable,information architecture,qualification,scale,MLN
909,Business processes should be streamlined but the process remains vague.,streamlined,Business processes,remains,vague,MLN
910,The infrastructure must support rapid deployment without defining 'rapid'.,rapid,deployment,infrastructure,support,MLN
911,Application performance needs to be superior and doesn't get compared to any benchmark.,superior,performance,Application,benchmark,MLN
912,Adoption of the software should be straightforward with no clear guidelines.,straightforward,software,Adoption,guidelines,MLN
913,"The platform requires universal access, yet 'universal' is not quantified.",universal,access,platform,quantified,MLN
914,An interactive experience is critical with no mention of interaction types.,interactive,experience,critical,interaction types,MLN
915,"Data processing must be seamless, though the term 'seamless' is not explored.",seamless,Data processing,must be,explored,MLN
916,The UI should be visually appealing without specifying aesthetic criteria.,visually appealing,UI,specifying,aesthetic criteria,MLN
917,Updates shall be regular without the intervals being defined.,regular,Updates,shall be,intervals,MLN
918,"The software should ensure data integrity, but the methods of integrity are not mentioned.",data integrity,software,ensure,methods,MLN
919,"Customizable settings are a key feature, however, 'customizable' lacks definition.",Customizable,settings,key feature,definition,MLN
920,The system should ensure data consistency but fails to clarify what consistency entails.,system,data consistency,,,MLN
921,Users must be able to operate the interface without any definition of 'operate'.,users,interface,operate,,MLN
922,Performance should be optimal with no criteria for measuring 'optimal'.,performance,,optimal,,MLN
923,"Security measures should be robust, yet 'robust' is not quantified or explained.",security measures,,robust,,MLN
924,"The application will support multitasking; however, the scope of multitasking is vague.",application,multitasking,,,MLN
925,"System reliability is a priority, with no specifics provided on reliability.",system,reliability,,,MLN
926,"The software will be user-friendly, yet 'user-friendly' remains undefined.",software,user-friendly,,,MLN
927,Transactions must be secure without establishing what 'secure' means.,transactions,secure,,,MLN
928,"The interface should be intuitive, but 'intuitive' lacks a clear definition.",interface,intuitive,,,MLN
929,Maintenance processes must be easy without explaining 'easy'.,maintenance processes,easy,,,MLN
930,"The protocol shall ensure timely response, but 'timely' is not further elaborated.",protocol,timely response,,,MLN
931,Search functionality will be comprehensive without specifying 'comprehensive'.,search functionality,comprehensive,,,MLN
932,"Updates must be seamless, with no description of what qualifies as 'seamless'.",updates,seamless,,,MLN
933,System scalability should be considered without detailing the aspects of 'scalability'.,system,scalability,,,MLN
934,"User information ought to remain confidential, yet 'confidential' is undefined.",user information,confidential,,,MLN
935,The system will facilitate collaboration but doesn't define 'collaboration'.,system,collaboration,,,MLN
936,Error messages should be informative without detailing what is 'informative'.,error messages,informative,,,MLN
937,"Accessibility features must be adequate, yet 'adequate' lacks detail.",accessibility features,adequate,,,MLN
938,Data protection measures are required without clarity on 'protection'.,data,protection measures,,,MLN
939,Hardware compatibility should be maximized without a clear definition of 'compatibility'.,hardware,compatibility,maximized,,MLN
940,"The software delivery is expected to be punctual, although 'punctual' is not explained.",software,delivery,punctual,,MLN
941,"Application performance should be stable, with 'stable' not being operationalized.",application,performance,stable,,MLN
942,"Implementation timeline must be realistic, but 'realistic' is not further discussed.",implementation,timeline,realistic,,MLN
943,The solution will be future-proof without explaining what makes it 'future-proof'.,solution,future-proof,,,MLN
944,"Reporting tools ought to be dynamic, yet 'dynamic' is not qualified.",reporting tools,dynamic,,,MLN
945,"The system should support efficient workflows, with 'efficient' left vague.",system,workflows,efficient,,MLN
946,"Backup processes must be reliable, without what constitutes 'reliable' being defined.",backup processes,reliable,,,MLN
947,"Data synchronization should occur seamlessly, but 'seamlessly' is not made clear.",data,synchronization,seamlessly,,MLN
948,"User settings must provide flexibility, although 'flexibility' is not clarified.",user settings,flexibility,,,MLN
949,"The user experience needs to be seamless; however, 'user experience' and 'seamless' are not described.",user experience,seamless,,,MLN
950,"Load times shall be minimal, but 'minimal' lacks precision.",load times,minimal,,,MLN
951,"The interface should be customized according to user preference, with 'customized' remaining vague.",interface,user preference,customized,,MLN
952,Notifications must be timely without establishing the timing specifics.,notifications,timely,,,MLN
953,"App features must be innovative, yet 'innovative' is not contextualized.",app,features,innovative,,MLN
954,"Information should be easily accessible, though 'easily accessible' is not exemplified.",information,accessible,easily,,MLN
955,Support for multiple languages must be robust without defining 'robust' support.,support,multiple languages,robust,,MLN
956,"Product scalability should be taken into account, with 'scalability' not made explicit.",product,scalability,,,MLN
957,"The application must maintain high availability, yet 'high availability' is not defined.",application,high availability,,,MLN
958,Upgrades should be straightforward without elucidating 'straightforward'.,upgrades,straightforward,,,MLN
959,"Software integration with existing systems must be smooth, with 'smooth' integration not clarified.",software,integration,smooth,existing systems,MLN
960,User profile must contain preferences yet these preferences aren't outlined anywhere,preferences,,,,MLN
961,"Order processing system escalates notifications, without a clear mechanism",escalates,notifications,,,MLN
962,Inventory check should be real-time but does not specify how real-time is measured or controlled,real-time,,,,MLN
963,"System shall ensure data integrity, yet it lacks definition of 'data integrity'",data integrity,,,,MLN
964,The workflow includes a validation step which isn't further described,validation step,,,,MLN
965,"Seamless experience should be provided, though 'seamless' isn't quantified",seamless,,,,MLN
966,The solution must be scalable without specifying how to evaluate scalability,scalable,,,,MLN
967,"Account data must be protected, the term 'protected' needs further explanation",protected,,,,MLN
968,Enhanced user experience is required without a definition of 'enhanced',enhanced,user experience,,,MLN
969,"Error messages should be informative, but what is considered 'informative' is not clear",informative,error messages,,,MLN
970,Implementation must be cost-effective without defining 'cost-effective',cost-effective,,,,MLN
971,Security measures should be robust where 'robust' isn't explained,robust,security measures,,,MLN
972,"Product should have an intuitive interface, yet 'intuitive' remains undefined",intuitive,interface,,,MLN
973,Support for legacy systems is required but without detailing what it involves,support,legacy systems,,,MLN
974,"Application must be user-friendly, however 'user-friendly' lacks a precise meaning",user-friendly,application,,,MLN
975,Fault tolerance is cited but not further elaborated or defined,fault tolerance,,,,MLN
976,System uptime should be 99.9% but 'uptime' is not sufficiently described,uptime,,,,MLN
977,"Data should be presented in a user-centric way, with no explanation of 'user-centric'",user-centric,,,,MLN
978,"To enhance performance, caching must be used without specifying caching guidelines",caching,performance,,,MLN
979,Using cutting-edge technology is proposed without stating what 'cutting-edge' means,cutting-edge,technology,,,MLN
980,Customer data must be anonymized although 'anonymized' is not clarified,anonymized,customer data,,,MLN
981,"The interface should be modern, yet the term 'modern' is vague",modern,interface,,,MLN
982,Functionality should be future-proof without a clear notion of 'future-proof',future-proof,functionality,,,MLN
983,"Data transmission needs to be seamless, with no context for 'seamless'",seamless,data transmission,,,MLN
984,The application should have failover capabilities without detailing 'failover',failover,capabilities,,,MLN
985,"All notifications shall be timely, lacking specifics on what constitutes 'timely'",timely,notifications,,,MLN
986,The system must offer robust reporting with no criteria for 'robust',robust,reporting,,,MLN
987,Intuitive navigation is required without identifying what makes navigation 'intuitive',intuitive,navigation,,,MLN
988,System shall be built with high availability in mind yet 'high availability' is undefined,high availability,,,,MLN
989,"Reporting features should offer actionable insights, but 'actionable' isn't expounded",actionable,insights,,,MLN
990,Platform must support high transaction volumes without defining 'high transaction volumes',high transaction volumes,support,,,MLN
991,"The system requires consistent uptime, but 'consistent' is not elaborated upon",consistent,uptime,,,MLN
992,Personalization options shall be extensive without providing what 'extensive' entails,extensive,personalization options,,,MLN
993,Metrics should be tracked real-time although 'real-time' tracking is not explained,real-time,metrics,,,MLN
994,"The system must employ an easy-to-use interface, yet 'easy-to-use' is subjective",easy-to-use,interface,,,MLN
995,Partner integrations should be seamless without an explanation of what 'seamless' includes,seamless,partner integrations,,,MLN
996,"Downtime incidents must be minimized, but 'minimized' is not defined",minimized,downtime incidents,,,MLN
997,System should support rapid deployment without defining 'rapid deployment',rapid deployment,support,,,MLN
998,"Users must be able to export data easily, but what constitutes 'easily' is not clear",easily,export data,,,MLN
999,"The interface needs to be responsive, without a qualitative measure for 'responsive'",responsive,interface,,,MLN
1000,User data shall be stored securely,User data,,stored securely,,MLN
1001,The system shall provide accurate time records,The system,time records,provide,accurate,MLN
1002,All reports shall be generated periodically,reports,,generated,periodically,MLN
1003,Maintenance tasks are to be minimized,Maintenance tasks,,minimized,,MLN
1004,The configuration settings should be customizable,configuration settings,,customizable,,MLN
1005,Notifications must be sent in real-time,Notifications,,sent,real-time,MLN
1006,The database needs to be scalable,database,,scalable,,MLN
1007,Data transmission must adhere to encryption protocols,Data transmission,,adhere,encryption protocols,MLN
1008,Interfaces should be user-friendly,Interfaces,,user-friendly,,MLN
1009,Error messages must be understandable,Error messages,,understandable,,MLN
1010,Backup processes shall be automatic,Backup processes,,automatic,,MLN
1011,Users must have the ability to export data,Users,,ability,export data,MLN
1012,The interface shall be accessible via multiple devices,interface,,accessible,multiple devices,MLN
1013,The software should function under various conditions,software,,function,various conditions,MLN
