ID,Excerpt,SY1,SY2,CO1,CO2,LQ Code
1014,Data integrity checks will be performed regularly,Data integrity checks,,performed,regularly,MLN
1015,Search feature must be quick and efficient,Search feature,,quick and efficient,,MLN
1016,The algorithm should prioritize speed and accuracy,algorithm,,prioritize,speed and accuracy,MLN
1017,User authentication will be multi-layered,User authentication,,multi-layered,,MLN
1018,The event log shall store all user activities,event log,,store,user activities,MLN
1019,Third-party integrations must be secure and reliable,Third-party integrations,,secure and reliable,,MLN
1020,The client profile should include extensive details,client profile,,include,extensive details,MLN
1021,Automated tasks should not require manual intervention,Automated tasks,,require,manual intervention,MLN
1022,Software updates must be carried out with minimal downtime,Software updates,,carried out,minimal downtime,MLN
1023,The payment gateway must support multiple currencies,payment gateway,,support,multiple currencies,MLN
1024,Account creation shall be streamlined and simple,Account creation,,streamlined and simple,,MLN
1025,User preferences should be preserved across sessions,User preferences,,preserved,across sessions,MLN
1026,All operations must be logged for auditing purposes,operations,,logged,auditing purposes,MLN
1027,Technical support should be available 24/7,Technical support,,available,24/7,MLN
1028,The project timeline must be adhered to strictly,project timeline,,adhered,strictly,MLN
1029,Risk management strategies should be clearly defined,Risk management strategies,,clearly defined,,MLN
1030,User feedback must be collected and analyzed,User feedback,,collected and analyzed,,MLN
1031,Login attempts should be limited to prevent brute force attacks,Login attempts,,limited,prevent brute force attacks,MLN
1032,Product features must be consistent with marketing materials,Product features,,consistent,marketing materials,MLN
1033,The application must scale with user growth,application,,scale,user growth,MLN
1034,Backup frequency should be configurable by the admin,Backup frequency,,configurable,admin,MLN
1035,Email verification is necessary for account security,Email verification,,necessary,account security,MLN
1036,The network infrastructure must ensure data continuity,network infrastructure,,ensure,data continuity,MLN
1037,Access levels should be defined for different user roles,Access levels,,defined,different user roles,MLN
1038,System performance metrics shall be tracked over time,System performance metrics,,tracked,over time,MLN
1039,Resource allocation must be optimized for peak usage,Resource allocation,,optimized,peak usage,MLN
1040,The interface module should provide user configuration accessibility.,interface module,,user configuration,accessibility,MLN
1041,Data synchronization needs to be seamless across various platforms.,Data synchronization,,seamless,platforms,MLN
1042,System architecture must support robust scaling solutions.,System architecture,,robust scaling,solutions,MLN
1043,The deployment pipeline should ensure high-level security compliance.,deployment pipeline,,high-level security,compliance,MLN
1044,Authentication procedures must adhere to industry sanctioning bodies.,Authentication procedures,,industry,sanctioning bodies,MLN
1045,Backup operations need to be executed with minimal service disruption.,Backup operations,,minimal service,disruption,MLN
1046,Data retrieval times shall not exceed the predefined threshold limits.,Data retrieval,times,predefined threshold,limits,MLN
1047,The reporting feature needs to aggregate results in a user-friendly manner.,reporting feature,,aggregate results,user-friendly,MLN
1048,Horizontal scaling should be realized without manual intervention.,Horizontal scaling,,realized,manual intervention,MLN
1049,Error handling mechanisms must provide clarity and avoid generic messages.,Error handling mechanisms,,clarity,generic messages,MLN
1050,Security protocols should be updated in accord with new threats identified.,Security protocols,,updated,new threats,MLN
1051,Monitoring tools need to detect anomalies and alert the corresponding teams.,Monitoring tools,anomalies,alert,teams,MLN
1052,User profiles shall include customizable privacy settings.,User profiles,privacy settings,customizable,,MLN
1053,The software must facilitate easy integration with third-party services.,software,integration,third-party services,easy,MLN
1054,Documentation should be comprehensive but not overwhelm the reader.,Documentation,,comprehensive,overwhelm,MLN
1055,System alerts must be clearly identifiable and differentiated from notifications.,System alerts,notifications,identifiable,differentiated,MLN
1056,Log files should be structured to aid in rapid fault analysis.,Log files,,structured,rapid fault analysis,MLN
1057,Query execution must be optimized for performance without compromising data accuracy.,Query execution,,optimized,performance,MLN
1058,Search functionality shall provide filters to refine the results.,Search functionality,filters,refine,results,MLN
1059,Audit trails need to be immutable to ensure traceability.,Audit trails,,immutable,traceability,MLN
1060,Third-party APIs should guarantee data privacy according to our standards.,Third-party APIs,,data privacy,standards,MLN
1061,Database schema changes must be backward compatible to avoid system downtime.,Database schema,changes,backward compatible,system downtime,MLN
1062,The notification module shall provide various customization options.,notification module,,customization options,,MLN
1063,Data protection features need to be compliant with international regulations.,Data protection features,,compliant,international regulations,MLN
1064,Cloud storage solutions must prioritize data redundancy for recovery purposes.,Cloud storage,solutions,data redundancy,recovery purposes,MLN
1065,The user interface should facilitate effortless navigation.,user interface,navigation,facilitate,effortless,MLN
1066,Real-time analytics must provide actionable insights for decision-making.,Real-time analytics,,actionable insights,decision-making,MLN
1067,Cryptographic protocols shall be implemented to safeguard sensitive data.,Cryptographic protocols,,implemented,sensitive data,MLN
1068,Customer support channels need to be accessible across all devices.,Customer support channels,,accessible,all devices,MLN
1069,Role-based access controls should enforce the principle of least privilege.,Role-based access controls,,enforce,least privilege,MLN
1070,All data transfers must be executed over secure transmission channels.,data transfers,,executed,secure transmission channels,MLN
1071,The application shall allow for effortless data export and import options.,application,,effortless data export,import options,MLN
1072,Service level agreements must outline expected performance metrics clearly.,Service level agreements,,outline,performance metrics,MLN
1073,Multi-language support should be a core feature of the user interface.,Multi-language support,,core feature,user interface,MLN
1074,Data integrity checks need to be performed periodically to maintain system health.,Data integrity checks,,performed,system health,MLN
1075,Error logs should be intuitive and provide quick recovery options.,Error logs,,intuitive,quick recovery options,MLN
1076,User feedback must be collected and analyzed to improve the software.,User feedback,,collected,analyzed,MLN
1077,Data analytics shall provide trend analysis for predictive decision-making.,Data analytics,,trend analysis,predictive decision-making,MLN
1078,The platform needs to enable cross-functional team collaboration effectively.,platform,,cross-functional team,collaboration,MLN
1079,Automated testing frameworks should reliably simulate real-world scenarios.,Automated testing frameworks,,reliably simulate,real-world scenarios,MLN
1080,The system shall facilitate user interactions without defining user roles.,system,user interactions,,,MLN
1081,"Data is stored in a secure manner, but without specification of security protocols.",Data,secure manner,,,MLN
1082,Encryption methods employed are robust where robustness is not defined.,Encryption methods,,robust,,MLN
1083,Reports can be generated with ease without specifying the ease of generation.,Reports,,generated with ease,,MLN
1084,"Access rights are managed effectively, yet effectiveness is not elaborated.",Access rights,,managed effectively,,MLN
1085,The interface will be user-friendly without explaining what user-friendly entails.,interface,,user-friendly,,MLN
1086,Navigation through the application will be intuitive but does not define intuitive navigation.,Navigation,application,,intuitive,MLN
1087,Error messages will be clear without a description of what constitutes clarity.,Error messages,,clear,,MLN
1088,"Users will experience seamless operation, with no detail on seamless experience.",Users,,seamless operation,,MLN
1089,Output will be accurate without indication of accuracy standards or measures.,Output,,accurate,,MLN
1090,"The platform will have a fast response time, but no criteria for speed are given.",platform,,fast response time,,MLN
1091,Optimization will occur in real-time with no clarification on optimization.,Optimization,,real-time,,MLN
1092,"Updates will happen promptly, yet promptness lacks definition.",Updates,,promptly,,MLN
1093,"System will be available always, but 'always' remains quantitatively ambiguous.",System,,available,always,MLN
1094,Compatibility with leading standards will be ensured without mentioning the standards.,Compatibility,,leading standards,,MLN
1095,Performance will be maximized with no parameters for measuring performance.,Performance,,maximized,,MLN
1096,Data retrieval will be streamlined without a clear definition of 'streamlined'.,Data retrieval,,streamlined,,MLN
1097,Software will be adaptable to any changes lacking a description of adaptability.,Software,,adaptable,any changes,MLN
1098,"The workflow will be optimized for efficiency, without benchmarks for efficiency.",workflow,,optimized,efficiency,MLN
1099,Using the module will be straightforward with no explanation of 'straightforward'.,module,,straightforward,,MLN
1100,Integration into existing systems will be effortless but does not define effort.,Integration,existing systems,,effortless,MLN
1101,Security measures are industry-leading with no context for the industry standard.,Security measures,,industry-leading,,MLN
1102,Support will be responsive at all times without a measure of response times.,Support,,responsive at all times,,MLN
1103,The application will be scalable to any load without an explanation of scalability.,application,,scalable,any load,MLN
1104,High availability is guaranteed without details on availability levels.,High availability,,guaranteed,,MLN
1105,Transition to the new system will be smooth yet 'smooth' is not described.,Transition,new system,,smooth,MLN
1106,The user manual will be comprehensive but lacks the scope of comprehensiveness.,user manual,,comprehensive,,MLN
1107,"This feature is future proof, with no indications of future contingencies.",feature,,future proof,,MLN
1108,"Recovery protocols are state-of-the-art, without a definition of the current state.",Recovery protocols,,state-of-the-art,,MLN
1109,"Implementation costs will be minimal, without establishing cost boundaries.",Implementation costs,,minimal,,MLN
1110,"Ergonomics are user-centric, yet 'user-centric' is not further outlined.",Ergonomics,,user-centric,,MLN
1111,"The design will be cutting-edge, but fails to define 'cutting-edge' in context.",design,,cutting-edge,,MLN
1112,"Routine maintenance will be zero-impact, with no details on impact measurement.",Routine maintenance,,zero-impact,,MLN
1113,Onboarding process will be streamlined yet the process remains undefined.,Onboarding process,,streamlined,,MLN
1114,The output will be clear and concise without criteria for clarity or conciseness.,output,,clear and concise,,MLN
1115,Data processing will be lightning fast with no benchmark for 'fast'.,Data processing,,lightning fast,,MLN
1116,Data integrity checks are foolproof without defining 'foolproof' processes.,Data integrity checks,,foolproof,,MLN
1117,"The backup system will be fail-safe, without detail on the fail-safe mechanism.",backup system,,fail-safe,,MLN
1118,"The loading time will be insignificant, but does not quantify 'insignificant'.",loading time,,insignificant,,MLN
1119,The software update procedure is straightforward without a procedure outline.,software update,procedure,,straightforward,MLN
1120,User access levels shall be defined.,access levels,,user,,MLN
1121,Password integrity must be guaranteed at all times.,Password integrity,,password,integrity,MLN
1122,Data synchronization shall be continuous and seamless.,Data synchronization,,data,synchronization,MLN
1123,The application will have service latency not exceeding two seconds.,service latency,,application,service,MLN
1124,All financial records shall be preserved for a minimum of five years.,financial records,,records,financial,MLN
1125,The system will support multi-language interfaces.,multi-language interfaces,,system,interfaces,MLN
1126,User profiles must be customizable and secure.,User profiles,,user,profiles,MLN
1127,Real-time analytics should provide actionable insights.,Real-time analytics,,analytics,insights,MLN
1128,System backups must occur without disrupting user activities.,System backups,,system,backups,MLN
1129,The interface should be intuitive and user-friendly.,interface,,interface,user,MLN
1130,Error messages need to be informative and helpful.,Error messages,,error,messages,MLN
1131,Automated reports shall be generated on a daily basis.,Automated reports,,reports,automation,MLN
1132,Encryption methods must adhere to industry standards.,Encryption methods,,encryption,methods,MLN
1133,Feedback loops should facilitate continuous improvement.,Feedback loops,,feedback,improvement,MLN
1134,Search functionality needs to be optimized for speed and accuracy.,Search functionality,,search,functionality,MLN
1135,Cloud storage options shall include redundancy and failover capabilities.,Cloud storage options,redundancy,storage,cloud,MLN
1136,There will be regular updates to the software.,regular updates,,software,updates,MLN
1137,Authentication measures must prevent unauthorized access.,Authentication measures,,authentication,access,MLN
1138,The system's performance metrics should be monitored.,performance metrics,,system,performance,MLN
1139,A user manual will be provided with the software.,user manual,,user,manual,MLN
1140,Support for legacy systems must be ensured.,Support for legacy systems,,support,legacy systems,MLN
1141,Data privacy safeguards shall be articulated in the design.,Data privacy safeguards,,data,privacy,MLN
1142,The architecture must be scalable and modular.,architecture,scalable,architecture,modular,MLN
1143,Integration with third-party services should be smooth.,Integration with third-party services,,integration,services,MLN
1144,Server capacity needs to accommodate peak usage periods.,Server capacity,peak usage periods,server,usage,MLN
1145,Audit trails must be comprehensive and tamper-proof.,Audit trails,,audit,trails,MLN
1146,A robust API will allow for third-party integrations.,robust API,,API,third-party integrations,MLN
1147,There should be a clear escalation path for issues.,escalation path,,escalation,issues,MLN
1148,Software updates will be pushed to devices without downtime.,Software updates,,software,updates,MLN
1149,Access logs must be maintained and periodically reviewed.,Access logs,,access,logs,MLN
1150,Deployment processes shall be automated.,Deployment processes,,deployment,processes,MLN
1151,Product features need to be market-driven and user-centric.,Product features,,product,features,MLN
1152,Disaster recovery planning must be a part of the initial design.,Disaster recovery planning,,disaster recovery,planning,MLN
1153,The application will be compatible with modern browsers.,application compatibility,,application,browsers,MLN
1154,User activity shall be tracked for security purposes.,User activity,,user,activity,MLN
1155,File upload size limits must be reasonable.,File upload size limits,,file,upload,MLN
1156,The system should maintain a high up-time percentage.,system up-time,,system,up-time,MLN
1157,Notifications must be timely and relevant.,Notifications,,notifications,relevance,MLN
1158,Security protocols should be updated to combat new threats.,Security protocols,,security,protocols,MLN
1159,Reporting tools must provide a variety of export formats.,Reporting tools,export formats,reporting,tools,MLN
1160,"The user profile shall include the user preferences, which may redefine user permissions.",user profile,user preferences,user personalization data,user permission settings,AMB
1161,"Upon login, the session information should provide access details and relevant user data.",session information,,user authentication data,user identification data,AMB
1162,The system will record logs as operation history for both errors and activities.,logs,operation history,error records,activity trail,AMB
1163,Customer support should provide both troubleshooting and advice to users experiencing issues.,troubleshooting,advice,technical assistance,user guidance,AMB
1164,The feedback system will collect user comments and complaints regularly.,feedback system,user comments,customer feedback collection,user complaints handling,AMB
1165,Storage capacity must be examined periodically to ensure data retention and backup.,storage capacity,,data storage limit,data backup process,AMB
1166,The notification feature should alert the team members when milestones are achieved.,notification feature,,achievement alerts,milestone tracking,AMB
1167,A detailed report may include revenue trends and sales figures for strategic planning.,detailed report,revenue trends,financial analysis,sales data,AMB
1168,The content management platform will handle both document creation and content distribution.,content management platform,document creation,content authoring tools,content delivery mechanisms,AMB
1169,Security protocols should mitigate risks associated with data breaches and unauthorized access.,security protocols,data breaches,risk mitigation measures,access control policies,AMB
1170,The task scheduler will prioritize tasks based on urgency and importance.,task scheduler,prioritize tasks,urgency assessment,importance evaluation,AMB
1171,Client onboarding involves collecting client details and setting up account preferences.,client onboarding,collecting client details,client registration process,account configuration,AMB
1172,The loyalty program should reward consistent purchases and enhance customer engagement.,loyalty program,consistent purchases,customer rewards system,engagement strategies,AMB
1173,The analysis tool will compare historical and current data to forecast future trends.,analysis tool,historical data,data comparison function,trend forecasting,AMB
1174,Employees must submit timesheets every week for both worked hours and leave taken.,timesheets,worked hours,time tracking,leave management,AMB
1175,The new update will enhance system stability and reduce downtime incidents.,system stability,downtime incidents,system performance,availability,AMB
1176,Payment processing should be secure and support multiple payment methods.,payment processing,multiple payment methods,transaction security,payment options,AMB
1177,Automated reporting tools must generate both executive summaries and detailed analytics.,automated reporting tools,executive summaries,report creation,detailed analysis,AMB
1178,The marketing plan aims to increase brand awareness and drive sales growth.,marketing plan,brand awareness,marketing objectives,sales strategy,AMB
1179,Resource allocation must consider both current team capacity and future project needs.,resource allocation,team capacity,resource planning,project resource requirements,AMB
1180,The app should sync contacts across devices ensuring availability and redundancy.,sync contacts,,data synchronization,data availability,AMB
1181,Quality assurance tests will identify defects and suggest improvements.,quality assurance tests,identify defects,defect detection process,improvement recommendations,AMB
1182,A backup solution should secure both company data and customer information against loss.,backup solution,company data,data protection,customer information security,AMB
1183,Permission levels will control access to sensitive data and operational components.,permission levels,sensitive data,access control,operational security,AMB
1184,The disaster recovery plan will address data restoration and continuity of operations.,disaster recovery plan,data restoration,data recovery,business continuity,AMB
1185,"The interface must be intuitive, allowing both experienced and novice users to navigate easily.",interface,experienced users,usability,novice user requirements,AMB
1186,Network monitoring tools will detect irregular traffic patterns and prevent intrusions.,network monitoring tools,irregular traffic patterns,traffic analysis,intrusion prevention,AMB
1187,All employees should receive training on both software use and data privacy regulations.,training,software use,employee education,data privacy compliance,AMB
1188,The project roadmap outlines development phases and release milestones.,project roadmap,development phases,project planning,release planning,AMB
1189,Inventory management should track stock levels and reorder points automatically.,inventory management,stock levels,inventory tracking,reorder automation,AMB
1190,Risk analysis will assess potential threats and their impact on business operations.,risk analysis,potential threats,threat assessment,impact analysis,AMB
1191,The cloud service provides scalable storage options and redundancies for data protection.,cloud service,scalable storage,storage scalability,data safety,AMB
1192,User preferences will be considered in future updates to personalize the experience.,user preferences,,personalization settings,experience customization,AMB
1193,Data encryption ensures the confidentiality of user information throughout transmission.,data encryption,user information,confidentiality maintenance,data transmission security,AMB
1194,A comprehensive warranty covers defects in materials and workmanship for a specified period.,warranty,defects in materials,warranty terms,workmanship quality guarantee,AMB
1195,The communication plan establishes protocols for information sharing and stakeholder engagement.,communication plan,information sharing,communication protocols,stakeholder communication strategies,AMB
1196,Performance benchmarks will set standards for service delivery and customer satisfaction.,performance benchmarks,service delivery,service performance standards,customer satisfaction metrics,AMB
1197,User manuals must include installation instructions and troubleshooting guidelines.,user manuals,installation instructions,product documentation,troubleshooting tips,AMB
1198,Penetration testing will evaluate system security and expose vulnerabilities to be addressed.,penetration testing,system security,security evaluation,vulnerability identification,AMB
1199,The CRM tool must integrate client information and sales data to facilitate relationship management.,CRM tool,client information,customer information integration,relationship management support,AMB
1200,The user's profile information shall be editable.,profile information,,user data,,AMB
1201,Access to the system shall require authentication.,access,,system entry,,AMB
1202,"The report shall include performance metrics, but may omit confidential data.",report,confidential data,document,sensitive information,AMB
1203,The software shall be capable of handling multiple user sessions.,user sessions,,concurrent access,,AMB
1204,Error messages should provide clear guidance.,Error messages,guidance,system alerts,assistance,AMB
1205,'Save' function will be available at all times.,Save,,data preservation,,AMB
1206,The search feature must return relevant results only.,search feature,relevant results,query tool,appropriate outcomes,AMB
1207,Users should be able to customize their dashboard.,customize,dashboard,personalize,user interface,AMB
1208,Notifications must be configurable by the user.,Notifications,configurable,alerts,customizable,AMB
1209,Password complexity requirements shall be enforced by the system.,Password complexity,enforced,security criteria,mandated,AMB
1210,The interface shall support drag-and-drop operations.,interface,drag-and-drop,user interface,manual data transfer,AMB
1211,User activity will be logged for security purposes.,User activity,logged,user actions,recorded,AMB
1212,The system shall provide synchronization capabilities with external devices.,synchronization,external devices,data alignment,third-party hardware,AMB
1213,The project timeline must be visible to all stakeholders.,project timeline,visible,schedule,accessible,AMB
1214,Data backup shall occur automatically without user intervention.,Data backup,automatically,data preservation,without manual input,AMB
1215,The architecture must support plug-and-play components.,architecture,plug-and-play,system structure,modular components,AMB
1216,The cloud service should provide high availability.,cloud service,high availability,online service,constant uptime,AMB
1217,User permissions shall be definable by administrators.,User permissions,definable,access rights,configurable,AMB
1218,The system shall facilitate data export in standard formats.,facilitate,data export,enable,data extraction,AMB
1219,The user interface should be intuitive and user-friendly.,user interface,intuitive,UI,easy to use,AMB
1220,Error logs should be detailed enough to aid debugging.,Error logs,detailed,system records,informative,AMB
