ID,Excerpt,SY1,SY2,CO1,CO2,LQ Code
345,It is crucial to monitor system performance and equally important to check system efficiency.,monitor system performance,check system efficiency,performance evaluation,,RDC
346,The solution should incorporate error detection and include fault identification.,error detection,fault identification,problem diagnosis,,RDC
347,The reporting system must generate summaries and also produce a synopsis of data.,generate summaries,produce a synopsis,data summarization,,RDC
348,Tools for data visualization shall be provided in addition to providing graphing capabilities.,data visualization,graphing capabilities,visual representation,,RDC
349,The capacity for processing requests and the ability to handle queries is essential.,processing requests,handle queries,request management,,RDC
350,Timely system updates are to be delivered along with the provision of recent patches.,system updates,recent patches,system maintenance,,RDC
351,The application has to support file downloads and also enable downloading documents.,file downloads,downloading documents,document retrieval,,RDC
352,User authorization using security tokens and the mechanism for access control with keycards should be implemented.,authorization,access control,user permission,,RDC
353,The ability to sort data and the capacity to order information logically are needed.,sort data,order information,data organization,,RDC
354,Resource allocation functions should be added as well as tools for distributing resources.,Resource allocation,distributing resources,resource distribution,,RDC
355,Data synchronization across devices must be supported as well as harmonizing data.,Data synchronization,harmonizing data,data consistency,,RDC
356,System usage monitoring and tracking of user activity patterns should be in place.,usage monitoring,user activity tracking,activity analysis,,RDC
357,The framework should ensure data integrity and also maintain the accuracy of information.,data integrity,accuracy of information,information reliability,,RDC
358,Automated backups must be performed as well as scheduled copying of data.,Automated backups,copying of data,data preservation,,RDC
359,Support for multiple languages and the provision for linguistics variety must be included.,multiple languages,linguistics variety,language support,,RDC
360,The system should have the capability to handle multiple user requests without loss of data.,system,,capability,user requests,INC
361,User profiles must be customizable to allow personalized settings.,User profiles,,customizable,settings,INC
362,Transaction records should be maintained for at least five years.,Transaction records,,maintained,five years,INC
363,Data encryption protocols must be employed to protect user information.,Data encryption protocols,,employed,user information,INC
364,The application shall provide notifications in case of any system errors.,application,,provide,notifications,INC
365,Backup procedures must be in place to prevent data loss.,Backup procedures,,in place,data loss,INC
366,Administrative personnel should have the ability to generate reports.,Administrative personnel,,ability,generate reports,INC
367,All financial transactions require audit trails for accountability purposes.,financial transactions,,require,audit trails,INC
368,The user interface must be intuitive and easy to navigate.,user interface,,intuitive,navigate,INC
369,A password reset feature should be accessible to the user without assistance.,password reset feature,,accessible,user,INC
370,Users must have the option to opt out of promotional emails.,Users,,option,promotional emails,INC
371,All user data shall be anonymized before aggregation for analytics.,user data,,anonymized,aggregation,INC
372,There must be a clear separation between user interface elements and system controls.,separation,,user interface elements,system controls,INC
373,System updates shall occur automatically without disrupting user activity.,System updates,,automatically,disrupting,INC
374,Customer support should be available 24/7 through multiple channels.,Customer support,,available,channels,INC
375,The application must support the latest encryption standards for data security.,application,,support,encryption standards,INC
376,Users should be able to customize their dashboard according to their needs.,Users,,customize,dashboard,INC
377,Error messages must be descriptive to facilitate troubleshooting.,Error messages,,descriptive,troubleshooting,INC
378,The system shall provide a way to recover forgotten passwords securely.,system,,provide,recover passwords,INC
379,Scheduled maintenance times should be communicated to users in advance.,Scheduled maintenance times,,communicated,users,INC
380,The database must be scalable to accommodate growing amounts of data.,database,,scalable,amounts of data,INC
381,Integration with third-party services should be seamless and secure.,Integration,,third-party services,secure,INC
382,The platform has to support multiple languages for a global user base.,platform,,support,multiple languages,INC
383,Data backups should be performed daily to ensure no loss of information.,Data backups,,performed,daily,INC
384,The software must allow users to export their data in a common file format.,software,,allow,export data,INC
385,Real-time analytics will enable decision makers to make informed choices.,Real-time analytics,,enable,decision makers,INC
386,Access to sensitive operations must require multi-factor authentication.,Access,,sensitive operations,multi-factor authentication,INC
387,There should be an assessment of network vulnerabilities once per quarter.,assessment,,network vulnerabilities,quarter,INC
388,All activities within the system must be logged for security auditing.,activities,,logged,security auditing,INC
389,Customers will receive updates about the service status via email or SMS.,Customers,,receive,updates,INC
390,The project timeline must include time for quality assurance testing.,project timeline,,include,quality assurance testing,INC
391,User feedback shall be collected and analyzed to improve the system.,User feedback,,collected,analyzed,INC
392,Server infrastructure must be robust to handle peak loads.,Server infrastructure,,robust,handle peak loads,INC
393,Continuous monitoring systems will ensure the operational health of the service.,Continuous monitoring systems,,ensure,operational health,INC
394,Documentation of all code changes is a requirement for future maintainability.,Documentation,,code changes,maintainability,INC
395,An interface shall exist for plug-and-play integration with different modules.,interface,,exist,integration,INC
396,The system's performance metrics should be visible to the admin users.,system's performance metrics,,visible,admin users,INC
397,Security protocols must be reviewed annually to keep up with new threats.,Security protocols,,reviewed,annually,INC
398,The software shall support concurrent users without degradation in performance.,software,,support,concurrent users,INC
399,Periodic testing of the backup systems must be scheduled to ensure reliability.,Periodic testing,,backup systems,scheduled,INC
400,The system shall enable user profile creation without specifying the user data schema.,system,,user profile creation,user data schema,INC
401,A list of available courses should be displayed with the criteria for each course to enroll.,list,,available courses,criteria,INC
402,Transaction records must be maintained without clearly defining a record structure.,Transaction records,,record structure,,INC
403,"Users are able to submit feedback, although the feedback mechanism isn't established.",Users,feedback mechanism,submit feedback,,INC
404,There will be a system notification feature without outlining the notification methods.,system notification feature,,notification methods,,INC
405,The application should support document upload without specifying file types.,application,,document upload,file types,INC
406,Orders can be placed using a digital cart which lacks a definition.,Orders,digital cart,,,INC
407,Security protocols need to be implemented but are not described.,Security protocols,,implemented,described,INC
408,User login shall be verified without explaining verification process.,User login,verification process,verified,,INC
409,The dashboard must show current status without defining what information it includes.,dashboard,,current status,information,INC
410,"Error logs should be analyzed, yet the analysis method remains unspecified.",Error logs,,analyzed,analysis method,INC
411,Data encryption must be utilized without detailing the encryption technique.,Data encryption,,utilized,encryption technique,INC
412,"The interface should be user-friendly, although 'user-friendly' is not quantified.",interface,,user-friendly,quantified,INC
413,Error handling routines are to be in place while being undefined.,Error handling routines,,place,undefined,INC
414,Search functionality will include filters without enumerating the filter options.,Search functionality,,include filters,filter options,INC
415,"User roles must be defined, without actually defining the specific roles.",User roles,,defined,specific roles,INC
416,"Backup operations will be automatic, yet the schedule is not set.",Backup operations,,automatic,schedule,INC
417,The report generation tool will compile data without specifying the data sources.,report generation tool,,compile data,data sources,INC
418,Customer support will be available 24/7 without a clear support protocol.,Customer support,,available 24/7,support protocol,INC
419,The software shall facilitate remote updates which are not further clarified.,software,,facilitate remote updates,clarified,INC
420,"An administrative panel is needed, though its features are not identified.",administrative panel,,needed,features,INC
421,Export function to save data externally without detailing supported formats.,Export function,,save data externally,supported formats,INC
422,User settings should be customizable with no indication of the customization scope.,User settings,,customizable,customization scope,INC
423,Notifications must be configurable despite lacking configuration details.,Notifications,,configurable,configuration details,INC
424,A recommendation algorithm will suggest products without explaining the criteria.,recommendation algorithm,,suggest products,criteria,INC
425,Analytical reports shall be generated monthly without specifying the content.,Analytical reports,,generated monthly,content,INC
426,"The system will support multiple languages, but does not list which ones.",system,,support multiple languages,list,INC
427,Users will be authenticated without mentioning the authentication process.,Users,,authenticated,authentication process,INC
428,Password strength guidelines to be enforced are not described.,Password strength guidelines,,enforced,described,INC
429,The shopping cart must keep items saved without stating retention duration.,shopping cart,,keep items saved,retention duration,INC
430,A user scoring system to be integrated with no details on the scoring mechanism.,user scoring system,,integrated,scoring mechanism,INC
431,"The email service will have an auto-reply feature, with auto-reply rules unaddressed.",email service,,auto-reply feature,auto-reply rules,INC
432,"Data syncing across devices is to be seamless, though the sync protocol is unknown.",Data syncing,,seamless,sync protocol,INC
433,Member accounts will feature access control without defining access levels.,Member accounts,,feature access control,access levels,INC
434,Periodic system audits to be conducted without a specified audit checklist.,Periodic system audits,,conducted,audit checklist,INC
435,The user interface shall provide help tips without a help content structure.,user interface,,provide help tips,help content structure,INC
436,"There must be a provision for system updates, but the update frequency is not stated.",provision for system updates,,must be,update frequency,INC
437,Files should be backed up in the cloud with no clarity on the backup schedule.,Files,,backed up in the cloud,backup schedule,INC
438,The event calendar should highlight important dates without specifying what is important.,event calendar,,highlight important dates,what is important,INC
439,"Mobile devices to support the application, though compatible models are not listed.",Mobile devices,,support the application,compatible models,INC
440,The system shall secure data transmission.,data transmission,,system,security,INC
441,User access levels must be configurable.,access levels,,user,configurable,INC
442,Notification of system errors should be recorded.,notification,,system errors,record,INC
443,Backups have to occur automatically without user intervention.,backups,,automatically,user intervention,INC
444,Data archiving procedures need specification.,procedures,,data archiving,specification,INC
445,Front-end design should be responsive.,design,,Front-end,responsive,INC
446,Encryption algorithms must be updated annually.,algorithms,,Encryption,annually,INC
447,Multilingual support is required for the interface.,support,,Multilingual,interface,INC
448,The customer support team should be available 24/7.,team,,customer support,available 24/7,INC
449,Bandwidth limitations need to be considered in the design phase.,limitations,,Bandwidth,design phase,INC
450,All financial transactions require encryption.,transactions,,financial,encryption,INC
451,Error messages must provide helpful guidance.,messages,,Error,guidance,INC
452,All user inputs should be validated before processing.,inputs,,user,processing,INC
453,The database must support concurrent transactions.,database,,concurrent,transactions,INC
454,Performance metrics need to be defined and collected.,metrics,,Performance,collected,INC
455,Server capacity expansion should be possible without downtime.,capacity,,Server,downtime,INC
456,Regular software updates are mandatory for security.,software updates,,Regular,security,INC
457,The reporting feature must include export to PDF functionality.,reporting feature,,export to PDF,,INC
458,Customer profiles should be editable by authorized personnel only.,profiles,,Customer,authorized personnel,INC
459,Disaster recovery plans need to be established and tested regularly.,recovery plans,,Disaster,tested regularly,INC
460,Session timeout duration must be configurable by an administrator.,timeout duration,,Session,administrator,INC
461,Login attempts should be limited to prevent brute force attacks.,Login attempts,,limited,brute force attacks,INC
462,User preferences need to persist across sessions.,preferences,,User,sessions,INC
463,The product must comply with international security standards.,product,,comply,international security standards,INC
464,Retrieval of account information should be done through secure channels.,Retrieval,,account information,secure channels,INC
465,Access to audit logs must be restricted to authorized staff.,Access,,audit logs,authorized staff,INC
466,Data import and export functionality needs clear documentation.,functionality,,Data import and export,documentation,INC
467,The system should support different levels of user access.,system,,support,user access levels,INC
468,A mechanism for password recovery must be in place.,mechanism,,password recovery,,INC
469,Automatic logging of all user actions should be enabled.,logging,,user actions,enabled,INC
470,High availability must be ensured for the online platform.,availability,,High,online platform,INC
471,Integration with third-party services needs to be seamless.,Integration,,third-party services,seamless,INC
472,Quality of service metrics should be monitored in real-time.,metrics,,Quality of service,monitored in real-time,INC
473,Up-to-date documentation is essential for system maintenance.,documentation,,Up-to-date,system maintenance,INC
474,The API should expose endpoints for data retrieval.,API,,expose,endpoints for data retrieval,INC
475,Password strength requirements must be defined and enforced.,Password strength,,requirements,enforced,INC
476,User interface themes need to be customizable.,themes,,User interface,customizable,INC
477,Audit trails for transactions should be maintained.,Audit trails,,transactions,maintained,INC
478,System usage statistics must be gathered for reporting.,statistics,,System usage,reporting,INC
479,Field validation rules need to prevent invalid data entry.,validation rules,,Field,invalid data entry,INC
480,The system should provide access to historical transaction records,system,,access,historical transaction records,INC
481,Users must be able to reset their passwords via email without assistance,Users,email,reset passwords,,INC
482,A notification shall be sent when the process is interrupted,notification,,process,interrupted,INC
483,Archive must store files securely for long-term,Archive,,store files,securely,INC
484,Sensitive user data should be encrypted,,,Sensitive user data,encrypted,INC
485,The camera functionality is required to capture images,camera functionality,,capture images,,INC
486,The application shall support multi-language interface,application,,support,multi-language interface,INC
487,A user profile must be created upon registration,user profile,,created,registration,INC
488,The device will automatically adjust settings based on location,device,,automatically adjust,settings,INC
489,Data synchronization should occur in real-time,,,Data synchronization,real-time,INC
490,The search feature must provide relevant results,search feature,,provide,relevant results,INC
491,Error messages should be descriptive and offer solutions,Error messages,,descriptive,offer solutions,INC
492,Backup operations must run on a weekly schedule,Backup operations,,run,weekly schedule,INC
493,The interface should be intuitive and user-friendly,interface,,intuitive,user-friendly,INC
494,The device must alert the user when battery is low,device,,alert,battery is low,INC
495,Reports generation feature will compile data from various sources,Reports generation feature,,compile data,various sources,INC
496,User permissions should be configurable,,,User permissions,configurable,INC
497,Payment processing must be secure and fast,Payment processing,,secure,fast,INC
498,An audit trail is necessary for tracking changes,audit trail,,necessary,tracking changes,INC
499,The system should minimize the occurrence of errors,system,,minimize,occurrence of errors,INC
500,Reporting tools must generate insights effectively,Reporting tools,,generate,insights,INC
501,The login process must be quick and secure,login process,,quick,secure,INC
502,Cloud storage integration is required for backup purposes,Cloud storage integration,,required,backup purposes,INC
503,The onboarding process should be straightforward and easy to follow,onboarding process,,straightforward,easy to follow,INC
504,The software must handle multiple concurrent users,software,,handle,multiple concurrent users,INC
505,Personalized recommendations shall be provided to users,Personalized recommendations,,provided,users,INC
506,The audit system must record every action of the user,audit system,,record,every action of the user,INC
507,Alerts will be customizable by the user,Alerts,,customizable,by the user,INC
508,The content management system must support versioning of documents,content management system,,support,versioning of documents,INC
509,Touchscreen support is necessary for the application,Touchscreen support,,necessary,for the application,INC
510,Passwords must be hashed and salted for security,Passwords,,hashed and salted,for security,INC
511,The platform should optimize for low-bandwidth conditions,platform,,optimize,for low-bandwidth conditions,INC
512,Users should receive feedback on successful operations,Users,,receive feedback,on successful operations,INC
513,A dashboard will provide an overview of system status,dashboard,,provide,an overview of system status,INC
514,The system must ensure data is consistent across all nodes,system,,ensure,data is consistent across all nodes,INC
515,Session management should prevent unauthorized data access,Session management,,prevent,unauthorized data access,INC
516,Support for third-party plugins is required,Support,,required,for third-party plugins,INC
517,Data analytics tools must interpret and visualize data accurately,Data analytics tools,,interpret,and visualize data accurately,INC
518,High availability should be maintained during peak hours,,,High availability,during peak hours,INC
519,Integration with existing systems should be seamless,Integration,,with existing systems,seamless,INC
520,User must be able to access the main interface,User,,access,main interface,INC
521,The system shall allow post-creation with text and images,system,,post-creation,text and images,INC
522,Password must meet complexity requirements,Password,,complexity requirements,,INC
523,Error messages should be logged internally,Error messages,,logged,internally,INC
524,Database updates require administrative privileges,Database updates,,administrative privileges,,INC
525,The server must automatically back up the data daily,server,,automatically back up,data daily,INC
526,Users should receive feedback within 24 hours,Users,,receive feedback,within 24 hours,INC
527,Search functionality needs to provide relevant results,Search functionality,,provide,relevant results,INC
528,Reports must be exportable in CSV and PDF formats,Reports,,exportable,CSV and PDF formats,INC
529,User preferences should persist between sessions,User preferences,,persist,between sessions,INC
530,The app requires an internet connection to function,app,,requires,internet connection,INC
531,Notification settings can be customized by the user,Notification settings,,customized,by the user,INC
532,The system should support multi-language UI,system,,support,multi-language UI,INC
533,The photo gallery will automatically organize images,photo gallery,,automatically organize,images,INC
534,The device must last a full day on a single charge,device,,last,a full day on a single charge,INC
535,Order confirmations shall be sent to the customer's email within minutes,Order confirmations,,sent,customer's email within minutes,INC
536,The product list will populate based on inventory levels,product list,,populate,inventory levels,INC
537,Each entry must have a corresponding timestamp,entry,,corresponding,timestamp,INC
538,The map view integrates traffic data for route optimization,map view,,integrates,traffic data for route optimization,INC
539,Saved files should maintain their formatting integrity,Saved files,,maintain,formatting integrity,INC
540,Guest accounts have limited access to features,Guest accounts,,limited access,features,INC
541,The platform must encrypt sensitive user data,platform,,encrypt,sensitive user data,INC
542,The weather widget will auto-refresh every hour,weather widget,,auto-refresh,every hour,INC
543,"To join the network, the device needs to authenticate",device,,join,network,INC
544,Message delivery status is viewable to the sender,Message delivery status,,viewable,to the sender,INC
545,Each user profile must include a unique identifier,user profile,,include,unique identifier,INC
546,Transactions will be processed in real-time,Transactions,,processed,real-time,INC
547,The navigation bar remains consistent across all pages,navigation bar,,remains,consistent across all pages,INC
548,Error handling routines must be defined for all modules,Error handling routines,,defined,all modules,INC
549,A user shall change their password every 90 days,user,,change,password every 90 days,INC
550,The API endpoints need to be documented for third-party integration,API endpoints,,documented,third-party integration,INC
551,The menu options will adapt based on user role,menu options,,adapt,user role,INC
552,A user's activity history is stored for generating reports,user's activity history,,stored,generating reports,INC
553,The application cache should clear on logout,application cache,,clear,on logout,INC
554,The help documentation is accessible within the app,help documentation,,accessible,within the app,INC
555,Session timeouts must be enforced for security,Session timeouts,,enforced,security,INC
556,Customer support is reachable through multiple channels,Customer support,,reachable,multiple channels,INC
557,Automated tests shall cover all core functionalities,Automated tests,,cover,all core functionalities,INC
558,The user interface scales to fit various screen sizes,user interface,,scales,fit various screen sizes,INC
559,Data synchronization occurs in the background,Data synchronization,,occurs,in the background,INC
560,User profiles need adjustment parameters,User profiles,,adjustment parameters,,INC
561,The security layer lacks definition,security layer,,definition,,INC
562,Reports will include various metrics without specification,Reports,,various metrics,specification,INC
563,"Interface should provide access control, yet no further details given",Interface,,access control,details,INC
564,Data synchronization protocol to be developed,Data synchronization protocol,,,,INC
565,System performance criteria are not outlined,System performance criteria,,outlined,,INC
566,Backup procedures requirement is missing a defined schedule,Backup procedures,,defined schedule,,INC
567,A configuration management process should exist,configuration management process,,exist,,INC
568,The authentication method must be specified,authentication method,,specified,,INC
569,User interface layout remains to be designed,User interface layout,,designed,,INC
570,Network infrastructure setup protocols are unwritten,Network infrastructure setup protocols,,unwritten,,INC
571,Database schema needs a full definition,Database schema,,full definition,,INC
572,Error handling procedures are missing concrete examples,Error handling procedures,,concrete examples,,INC
