ID,Excerpt,SY1,SY2,CO1,CO2,LQ Code
1,"The system shall provide a user dashboard, known as the control panel, for managing preferences.",user dashboard,control panel,preferences management,,RDC
2,"Notification system, also referred to as the alert module, must signal users effectively.",Notification system,alert module,signaling users,,RDC
3,All account information or user profile details shall be kept confidential.,account information,user profile details,confidentiality,,RDC
4,"Data retrieval, also known as data extraction, should be executed in a secure fashion.",Data retrieval,data extraction,secure execution,,RDC
5,"The client, also referred to as the customer, is entitled to support services.",client,customer,support services,,RDC
6,"Employees must adhere to the safety protocol, also named as the security procedure.",safety protocol,security procedure,employee adherence,,RDC
7,"The repository of information, also termed as the database, should be accessible at all times.",repository of information,database,accessibility,,RDC
8,"The login process, also identified as the authentication step, shall protect user privacy.",login process,authentication step,user privacy protection,,RDC
9,The backup solution or the storage backup must provide rapid data recovery options.,backup solution,storage backup,rapid data recovery,,RDC
10,The user authentication process shall validate credentials.,authentication process,credentials verification,user validation,,RDC
11,Data storage and data archiving mechanisms must be reliable.,data storage,data archiving,mechanisms,,RDC
12,Error messages should be clear and the information for error resolution should be precise.,error messages,error resolution information,clarity and precision,,RDC
13,System response time must not exceed two seconds per transaction.,response time,transaction speed,system performance,,RDC
14,The report generation feature should allow selecting time periods.,report generation,time period selection,feature functionality,,RDC
15,Access to customer data shall be logged and monitored.,access logging,monitoring,customer data protection,,RDC
16,The inventory tracking system must update stock levels in real-time.,inventory tracking,stock level updates,inventory management,,RDC
17,Support for multiple languages must be provided in the user interface.,multilingual support,language options,interface localization,,RDC
18,The system should record all transactions for audit purposes.,transaction recording,audit logging,record-keeping,,RDC
19,Backup procedures need to be in place and tested regularly.,backup procedures,regular tests,data safety,,RDC
20,Email notifications should be configurable by the end-user.,email notifications,notification settings,user preferences,,RDC
21,The search functionality must return results within three seconds.,search functionality,result retrieval,performance criteria,,RDC
22,Password integrity checks shall be enforced at all times.,password integrity,integrity checks,security requirements,,RDC
23,"The system must scale to support up to 10,000 concurrent users.",system scalability,user concurrency support,capacity requirement,,RDC
24,All system interfaces should be intuitive and user-friendly.,system interfaces,user experience,interface design,,RDC
25,Regular maintenance windows must be scheduled and communicated in advance.,maintenance windows,scheduled downtime,operational planning,,RDC
26,Users shall have the ability to export their data in a standard format.,data export,export functionality,user control,,RDC
27,Software updates must be deployed without disrupting the service.,software updates,service continuity,update process,,RDC
28,The system's operational status should be monitored 24/7.,system monitoring,operational status check,availability assurance,,RDC
29,User activities within the application must be traceable for security audits.,user activity tracking,security audits,traceability,,RDC
30,An onboarding process for new users must be developed to ease the learning curve.,onboarding process,user training,learning support,,RDC
31,The customer support system should provide automated responses to common questions.,customer support system,automated responses,helpdesk efficiency,,RDC
32,Confidential data should be encrypted both at rest and in transit.,data encryption,confidentiality measures,data protection,,RDC
33,Detailed logs of all system changes must be maintained to support troubleshooting.,change logs,system change tracking,troubleshooting,,RDC
34,The platform should be accessible from multiple device types and operating systems.,platform accessibility,cross-platform compatibility,operational flexibility,,RDC
35,Interfaces must present data visualizations in a user-friendly manner.,data visualizations,interface design,visual clarity,,RDC
36,Performance metrics for the system must be defined and measurable.,performance metrics,measurable indicators,system evaluation,,RDC
37,Data integrity and accuracy must be maintained at all times.,data integrity,accuracy maintenance,data quality,,RDC
38,Privacy settings should be customizable by the user to enhance personal data protection.,privacy settings,data protection customization,user privacy,,RDC
39,Processes for data backup must be automated to prevent human error.,data backup processes,automation,error prevention,,RDC
40,The system should automatically update the user's location based on GPS data.,automatic update,GPS-based location tracking,location detection,,RDC
41,All transactions performed by the system must be reversible for a certain period.,transaction reversibility,undo feature,operational safety,,RDC
42,Third-party integrations must be compatible and seamless.,third-party integrations,system compatibility,integration quality,,RDC
43,The notification system should alert users in case of system-wide issues.,notification system,system-wide alerts,user communication,,RDC
44,Reports generated by the system must be exportable in CSV and PDF formats.,report generation,format export options,output flexibility,,RDC
45,User profiles must include customizable privacy settings.,user profiles,customizable privacy,user control mechanisms,,RDC
46,Automated testing should cover all critical paths of the application.,automated testing,critical path coverage,application reliability,,RDC
47,The application must support data synchronization across devices.,data synchronization,cross-device updating,data consistency,,RDC
48,Access control lists should define user permissions accurately.,access control,user permissions,security policy,,RDC
49,The application must handle simultaneous requests without performance degradation.,simultaneous request handling,performance maintenance,application robustness,,RDC
50,Data exchange between modules must be secure and adhere to industry standards.,data exchange,module communication,security compliance,,RDC
51,Each user action should generate a corresponding log entry.,user actions,log entries,activity tracking,,RDC
52,Graphical elements on the user interface must be standardized.,graphical elements,interface standardization,visual consistency,,RDC
53,All data processing operations should be optimized for speed and efficiency.,data processing operations,performance optimization,operational efficiency,,RDC
54,The software should provide version control mechanisms for document management.,version control,document management,content revision tracking,,RDC
55,User permissions must be set according to roles and responsibilities.,user permissions,role-based access control,authorization management,,RDC
56,All features of the application must be documented in a user manual.,feature documentation,user manual,usage instructions,,RDC
57,Application logs must provide detailed information for debugging purposes.,application logs,debugging information,issue resolution,,RDC
58,User feedback should be collected periodically to improve the system.,user feedback collection,system improvement,quality enhancement,,RDC
59,The system should mitigate risks by enforcing strict security policies.,risk mitigation,security policy enforcement,risk management,,RDC
60,The user profile should have the user details as well as the personal information.,user profile,user details,profile information,,RDC
61,Client record shall include client data and also the client's personal details.,client record,client data,client information,,RDC
62,The report needs to contain the risk analysis and the risk assessment details.,risk analysis,risk assessment details,risk details,,RDC
63,Product specification must include product description and the specifications.,product specification,product description,product details,,RDC
64,The system should generate reports that include report documents as well as document summaries.,reports,report documents,summary documents,,RDC
65,Vehicle information must be recorded with vehicle details and vehicle specs.,vehicle information,vehicle details,vehicle specifications,,RDC
66,The library database should consist of book records and the catalog of books.,book records,catalog of books,library holdings,,RDC
67,Inventory list shall have item details as well as product descriptions.,inventory list,item details,inventory records,,RDC
68,The financial summary should cover profit margins and profitability reports.,financial summary,profit margins,profitability analysis,,RDC
69,The security protocol needs to define safety measures as well as security measures.,security protocol,safety measures,security guidelines,,RDC
70,Employee directory shall be comprehensive of staff records and employment details.,employee directory,staff records,employee data,,RDC
71,Network configuration should include network setup details as well as connectivity information.,network configuration,network setup details,network information,,RDC
72,The marketing plan needs to illustrate customer engagement strategies and client interaction methods.,marketing plan,customer engagement strategies,client interaction,,RDC
73,User manual must document the operational procedures and usage instructions.,user manual,operational procedures,manual instructions,,RDC
74,Order forms should contain purchase details as well as ordering information.,order forms,purchase details,ordering process,,RDC
75,Academic syllabus must list course contents along with curriculum details.,academic syllabus,course contents,curriculum specifications,,RDC
76,The FAQ section should cover frequently asked questions and common inquiries.,FAQ,frequently asked questions,common queries,,RDC
77,Software license agreement must have the licensing terms and the terms and conditions mentioned.,software license agreement,licensing terms,terms and conditions,,RDC
78,Tracking system shall monitor package locations and shipment tracking details.,tracking system,package locations,shipment details,,RDC
79,Sales projection report should outline sales estimates and forecasted sales figures.,sales projection report,sales estimates,sales forecasts,,RDC
80,The contract should define the agreement terms and the contractual obligations.,contract,agreement terms,contractual obligations,,RDC
81,Maintenance schedule must be clear on servicing times and maintenance activities.,maintenance schedule,servicing times,maintenance routines,,RDC
82,Technical documentation should contain the system requirements and the specifications.,technical documentation,system requirements,system specifications,,RDC
83,The orientation program ought to explain new employee onboarding as well as initiation procedures.,orientation program,new employee onboarding,initiation process,,RDC
84,The application form should gather applicant information and personal details.,application form,applicant information,applicant details,,RDC
85,Work orders must detail the job tasks and the task descriptions.,work orders,job tasks,task list,,RDC
86,The recruitment policy will articulate hiring rules along with staffing regulations.,recruitment policy,hiring rules,staffing guidelines,,RDC
87,Membership application should cover personal bio-data as well as membership details.,membership application,personal bio-data,membership information,,RDC
88,Incident reports ought to describe accident details and the incident specifics.,incident reports,accident details,incident accounts,,RDC
89,Travel itinerary must list travel schedules as well as the journey plan.,travel itinerary,travel schedules,travel plan,,RDC
90,Strategic roadmap should depict strategic initiatives and roadmap milestones.,strategic roadmap,strategic initiatives,roadmap targets,,RDC
91,Resource allocation plan must specify resource assignments as well as resource distribution.,resource allocation plan,resource assignments,resource management,,RDC
92,User access levels should be clear about permission levels and access rights.,user access levels,permission levels,access privileges,,RDC
93,The examination guidelines must detail the test procedures and the examination protocols.,examination guidelines,test procedures,examination rules,,RDC
94,User interviews should include questions about user experience as well as user satisfaction.,user interviews,user experience,user feedback,,RDC
95,The billing statement ought to reflect payment information and invoice details.,billing statement,payment information,invoice records,,RDC
96,Client proposals should outline project ideas as well as proposal summaries.,client proposals,project ideas,proposal outlines,,RDC
97,Machine maintenance logs must contain equipment service history and maintenance records.,maintenance logs,service history,equipment upkeep,,RDC
98,Investment portfolio shall present investment records and the financial assets.,investment portfolio,investment records,financial holdings,,RDC
99,Training program needs to cover educational content and learning materials.,training program,educational content,training resources,,RDC
100,The task assignments should list work components as well as duty specifics.,task assignments,work components,duty outlines,,RDC
101,Event plan ought to outline the event schedule and the activities timetable.,event plan,event schedule,event itinerary,,RDC
102,Customer profiles must include demographic information and customer preferences.,customer profiles,demographic information,customer tastes,,RDC
103,Risk management plan should detail risk mitigation strategies as well as contingency plans.,risk management plan,risk mitigation strategies,contingency measures,,RDC
104,Operational guidelines must clarify procedural rules and operating instructions.,operational guidelines,procedural rules,operating procedures,,RDC
105,The compliance checklist should encompass regulatory requirements as well as compliance actions.,compliance checklist,regulatory requirements,compliance steps,,RDC
106,Meeting minutes ought to summarize discussion points along with decision outcomes.,meeting minutes,discussion points,meeting decisions,,RDC
107,The quality assurance plan needs to define quality metrics as well as performance standards.,quality assurance plan,quality metrics,performance criteria,,RDC
108,Feedback forms must gather customer comments and client feedback.,feedback forms,customer comments,client opinions,,RDC
109,Audit reports should provide financial evaluations and audit findings.,audit reports,financial evaluations,audit results,,RDC
110,The system must validate user credentials before allowing access.,system,credentials,authentication,,RDC
111,User identification must be verified and the identity needs to be checked in the database.,user identification,identity,verification,,RDC
112,Password input and passcode entry shall be encrypted.,password input,passcode entry,encryption process,,RDC
113,The login procedure must authenticate users and the sign-in process must verify accounts.,login procedure,sign-in process,user authentication,,RDC
114,Account information and user details shall be synchronized and kept consistent.,account information,user details,data synchronization,,RDC
115,All the images and pictures in the document shall have captions and titles respectively.,images,pictures,visual content,,RDC
116,File saving and document storage should maintain backups regularly.,file saving,document storage,backup maintenance,,RDC
117,The error log and fault record should be reviewed daily to ensure system integrity.,error log,fault record,system check,,RDC
118,Activity history and operation logs must be archived for audit purposes.,activity history,operation logs,record archiving,,RDC
119,Resource allocation and asset distribution shall be optimized to increase efficiency.,resource allocation,asset distribution,optimization,,RDC
120,The inventory list must be updated and the itemized record must be refreshed to reflect current stock.,inventory list,itemized record,stock update,,RDC
121,Each staff member and every employee must clock in upon arrival.,staff member,employee,attendance,,RDC
122,Reports should be summarized and overviews should be condensed for the meeting.,reports,overviews,information summary,,RDC
123,The project timeline and development schedule should be aligned to ensure timely delivery.,project timeline,development schedule,time management,,RDC
124,Customer feedback and client reactions must be collated for quality assessment.,customer feedback,client reactions,feedback collection,,RDC
125,Revenue streams and income sources shall be analyzed for financial stability.,revenue streams,income sources,financial analysis,,RDC
126,Disaster recovery planning and emergency preparedness protocols need to be in place.,disaster recovery planning,emergency preparedness protocols,crisis management,,RDC
127,Risk assessment and hazard evaluation should be conducted periodically.,risk assessment,hazard evaluation,safety check,,RDC
128,Service level agreements and performance contracts must be honored at all times.,service level agreements,performance contracts,contractual obligations,,RDC
129,Budget constraints and financial limits shall be strictly observed.,budget constraints,financial limits,budget management,,RDC
130,Training sessions and educational workshops need to cater to the professional growth of employees.,training sessions,educational workshops,skill development,,RDC
131,Networking events and social mixers should facilitate industry connections.,networking events,social mixers,business networking,,RDC
132,Employee satisfaction surveys and workforce happiness indices shall be measured quarterly.,employee satisfaction surveys,workforce happiness indices,job satisfaction,,RDC
133,Software updates and system upgrades must be installed to maintain security.,software updates,system upgrades,technological maintenance,,RDC
134,The interface design and user experience should be intuitive and user-friendly.,interface design,user experience,usability,,RDC
135,Market research and consumer analysis need to be thoroughly executed to understand trends.,market research,consumer analysis,market understanding,,RDC
136,The helpdesk support and customer service teams must provide timely aid.,helpdesk support,customer service teams,assistance,,RDC
137,Health and safety regulations and workplace safety rules shall be adhered to strictly.,health and safety regulations,workplace safety rules,safety compliance,,RDC
138,Diversity policies and inclusion protocols should reflect the company's commitment to equality.,diversity policies,inclusion protocols,equal opportunity,,RDC
139,Quality assurance processes and quality control procedures must guarantee product standards.,quality assurance processes,quality control procedures,standard assurance,,RDC
140,Profit margins and earnings ratios shall be calculated for the fiscal year end.,profit margins,earnings ratios,financial performance,,RDC
141,Attendance records and presence logs must be kept up to date.,attendance records,presence logs,time tracking,,RDC
142,Technological developments and innovations in the field should be monitored consistently.,technological developments,innovations,industry advancements,,RDC
143,Data privacy guidelines and confidentiality rules need to be enforced without exception.,data privacy guidelines,confidentiality rules,information security,,RDC
144,User manuals and instruction guides shall be written in clear language.,user manuals,instruction guides,documentation clarity,,RDC
145,Feedback mechanisms and response systems should be in place for customer complaints.,feedback mechanisms,response systems,customer service,,RDC
146,Server downtime and system outages must be minimized.,server downtime,system outages,operational reliability,,RDC
147,The warranty terms and service guarantees shall be honored as per the agreement.,warranty terms,service guarantees,customer agreement,,RDC
148,Color palettes and design motifs need to be consistent across all marketing material.,color palettes,design motifs,brand consistency,,RDC
149,Resource utilization and consumption patterns should be analyzed to promote sustainability.,resource utilization,consumption patterns,sustainable practices,,RDC
150,Heating systems and cooling units must be regularly inspected for efficiency.,heating systems,cooling units,climate control maintenance,,RDC
151,Sales targets and revenue goals shall be set to motivate the sales team.,sales targets,revenue goals,performance objectives,,RDC
152,Customer profiles and buyer personas need to be developed for targeted marketing.,customer profiles,buyer personas,marketing strategy,,RDC
153,Company policies and organizational guidelines must be disseminated clearly to all staff.,company policies,organizational guidelines,policy communication,,RDC
154,Operational costs and expense metrics shall be reviewed monthly to manage the budget.,operational costs,expense metrics,budget review,,RDC
155,Health benefits and wellness programs should be offered to promote employee well-being.,health benefits,wellness programs,employee health,,RDC
156,The recruitment process and hiring procedure must be free from bias.,recruitment process,hiring procedure,fair employment,,RDC
157,Regular maintenance and periodic servicing shall ensure equipment longevity.,regular maintenance,periodic servicing,equipment care,,RDC
158,Strategic partnerships and business alliances need to be forged for market expansion.,strategic partnerships,business alliances,market growth,,RDC
159,Network security measures and cybersecurity protocols must protect against breaches.,network security measures,cybersecurity protocols,data protection,,RDC
160,"The system shall have the capability to restore previous configurations, enabling restoration of prior settings.",capability,restoration,restoring previous configurations,prior settings,RDC
161,"User preferences, as well as configuration settings, are both vital for personalization and should be saved.",user preferences,configuration settings,personalization,,RDC
162,"The application must permit account management, including the ability to manage user profiles.",account management,manage user profiles,user account operations,,RDC
163,"Error messages and warning notifications are required to notify users of issues and to alert them, respectively.",error messages,warning notifications,notify users of issues,alert them,RDC
164,Our platform should offer means to identify users and also authentication processes for security purposes.,identify users,authentication processes,security purposes,,RDC
165,Data synchronization across devices and sync across user devices is necessary for seamless user experience.,Data synchronization across devices,sync across user devices,seamless user experience,,RDC
166,The widget for user search and the search function must be swift and accurate.,widget for user search,search function,swift and accurate,,RDC
167,Reliable backup and data recovery are essential to guard against data loss.,backup,data recovery,guard against data loss,,RDC
168,Issue tracking tools and problem-tracking mechanisms must be employed to handle technical difficulties.,issue tracking tools,problem-tracking mechanisms,handle technical difficulties,,RDC
169,Sufficient storage space and adequate memory allocation should be ensured to facilitate data management.,storage space,memory allocation,facilitate data management,,RDC
170,User documentation and manuals shall be provided to assist with software usage.,User documentation,manuals,assist with software usage,,RDC
171,The system's performance metrics and its efficiency indicators should be monitored consistently.,performance metrics,efficiency indicators,monitored consistently,,RDC
172,Regular updates and routine maintenance procedures are part of system upkeep.,updates,maintenance procedures,system upkeep,,RDC
173,Customer assistance and support services should be available to resolve client issues.,Customer assistance,support services,resolve client issues,,RDC
174,Product inventory along with stock levels needs to be tracked for supply chain management.,product inventory,stock levels,tracked for supply chain management,,RDC
175,The interface for user input and the input mechanism must be user-friendly.,interface for user input,input mechanism,user-friendly,,RDC
176,Resource allocation and resource distribution processes need to be optimized for cost efficiency.,Resource allocation,resource distribution,optimized for cost efficiency,,RDC
177,Error logging and failure reporting should be implemented for system diagnostics.,error logging,failure reporting,system diagnostics,,RDC
178,Access control lists and permission settings are instrumental in securing user data.,Access control lists,permission settings,securing user data,,RDC
179,Email notifications and system alerts must be clear and timely for effective communication.,Email notifications,system alerts,effective communication,,RDC
180,Customer profiles and client information should be updated regularly to maintain accuracy.,customer profiles,client information,maintain accuracy,,RDC
